Job Title,Company,Location,Job Description
"Senior Manager, Strategy & Business Development (Regional IC...",Singtel,Singapore,"The Senior Manager, Strategy & Business Development will be part of the Regional ICT Enterprise team and is responsible for coordinating and driving all…"
"Manager, Digital Channel",Singtel,Singapore,This role of Digital Channel Manager is focused on in developing Singtel’s B2B next-generation digital channel for customer engagement across various Singtel…
"Snr Project Manager, IT Business Partner",Singtel,Singapore,This role is responsible for leading a cross functional and matrix team within the IT and business domains to deliver projects on time and on budget meeting the…
Network Infra Specialist (1-Yr Agency Contract) (130616),Singtel,Singapore,"The Network Infrastructure Specialist is responsible for respective Network & Security projects, including design, implementation and operations."
Solution Designer,Singtel,Singapore,"Provide application solution and design for projects/enhancement requests within the CS domain.
Work closely with different technical groups and SMEs to fulfill…"
#EG-SP - Senior / Lead - Systems Engineer (Vmware / Storage...,Singtel Group,Singapore,"Responsible for the system design, implementation, testing, managing and maintenance of proposed system.
Work closely with Team Leader to meet system delivery…"
Senior IT Technical Manager (Architecture),Singtel,Singapore,"Creates and owns the Team Backlog(s), User Stories and Iterations, Planning, overseeing development stages, Contributes to Vision, Roadmap and ROI of the…"
Senior Data Engineer,Singtel,Singapore,"Develop big data solutions for near real-time stream processing, as well as batch processing on the Big Data platform.
Schedule and maintain data pipelines."
#EG Infra-Lead Cloud Engineer (Cloud Architect),Singtel Group,Singapore,"Apply technical knowledge and customer insights to create a modernization roadmap.
Architect solutions to meet business and IT needs, ensuring technical…"
#EG-SP - Apps - Business System Analyst (.Net),Singtel Group,Singapore,"NCS also believes in building a strong partner eco-system with leading technology players, research institutions and start-ups to support open innovation and co…"
Lead Data Architect,Singtel,Singapore,"Understand the needs of business and the business vision.
Provide Architectural leadership and vision for Singtel’s Data Platform."
#EG-SP - Apps: Technical Senior/ Service Delivery Manager (J...,Singtel Group,Singapore,"You will lead and manage projects, work closely with various internal and external stakeholders to establish project plans, risk management plans, project…"
#EG-SP - Infra: Technical Senior/ Service Delivery Manager (...,Singtel Group,Singapore,"Manage the performance of services and ensure that Service Levels are achieved.
Engaging the customer and/or vendors to ensure the smooth delivery of services."
#EG-SP - Apps: DevOps Engineer/ Architect (AWS/ Cloud/ Appli...,Singtel Group,Singapore,"Build, Deploy & Implement Cloud Technology for our clients.
Responsible to deliver implementation with DevOps and Automation tools (E.g. Selenium, Bamboo,…"
