Job Title,Company,Location,Job Description
Enterprise Sales Manager,Singtel,"Dallas-Fort Worth, TX","Develop new and existing business.
Generate new revenue from Fortune 100 companies to meet an assigned annual sales quota.
Write and present customer proposals."
Solutions Manager,Singtel,"Redwood City, CA 94065",• The primary responsibility of the Solutions Manager is to provide Pre-Sales Technical Solutions to support Singtel USA business.
Network Specialist,Singtel,"Redwood City, CA 94065",This role provides valuable operations management to address operational matters promptly and effectively across various internal SingTel teams – resulting in…
"Engineer, Cybersecurity Engring & Ops",Singtel,Singapore,"We are looking for fresh graduates to join us as Cyber Security Analyst / Engineer in the areas of governance, planning, or operations."
Administrative Executive,Singtel,Singapore,"Provide and be responsible for full spectrum of administrative support for various teams with staff/vendor contractors.
Work with IT Project In-Charge."
Senior Customer Care Officer,Singtel,Singapore,"We’re looking a Singtel Care Advisor who loves solving problems and creating long term customer relationships.
Process orders, forms, applications and requests."
Customer Care Officer (SME Business Hotline),Singtel,Singapore,"Our representatives reach out to our customers through calls, chats or emails on their queries /feedback and walk them through basic troubleshooting."
Customer Care Officer,Singtel,Singapore,"Manage inbound calls, concurrent chats enquiries or business emails in a timely manner.
Provide extensive knowledge about specific products and services to…"
Customer Service Executive,Singtel,Singapore,"Coordinate and process New Mobile Applications, SIM Activation, Line Transfer, Activation of Value-Added Services (VASes), Re-contracting, etc."
Sales Operations Associate,Singtel,Singapore,"The primary purpose of the position is to support the Sales Operations Department.
This include but are not limited to order valiation, tracking of order status…"
Accounts Payable Executive,Singtel,Singapore,"Support payment & analysis requirements for cashflow management.
Work with reporting, onshore & offshore teams on payment transactions & reconciliations and…"
Customer Service Executive (1 year Agency Contract),Singtel,Singapore,"Coordinate and process New Mobile Applications, SIM Activation, Line Transfer, Activation of Value-Added Services (VASes), Re-contracting, etc."
Engineer - RNQ (Inbuilding Specialist Team),Singtel,Singapore,"In this role, you will be responsible for tunnel design strategy, RF requirement and technical solution evaluation to achieve cost effective tunnel coverage…"
Retail Executive,Singtel,Singapore,"Drives sales through active engagement of customers, sharing product knowledge, explains and demonstrates the different functions and features of the products."
Customer Care Officer (Bedok/Bukit Batok/Havelock) 1,Singtel,Singapore,The Customer Care Officer is responsible for handling inbound calls from customers in an efficient and effective manner.
Technician,Singtel Group,Singapore,"Responsible for the cable construction and maintenance works in Singtel.
These cables can subsequently be used for 5G, broadband or enterprise services."
Customer Care Specialist,Singtel,Singapore,We’re looking a Customer Care Specialist who loves embracing new challenges and creating long term customer relationships.
Senior Customer Care Officer (Agency),Singtel,Singapore,"Officers will have opportunities to work cross-functionally and manage challenging situations.
On-the-job training about different Singtel products will be…"
Customer Relationship Executive,Singtel,Singapore,"Communicate politely and timely with customers and stakeholders by SMS, email, letter, face to face, and telephone calls."
Sales Support Executive,Singtel,Singapore,"Provide sales support to business managers and account managers for any sales support requirement.
Provide assistance to sales people; manage large volume of…"
Fraud Specialist (Agency Contract),Singtel,Singapore,"Perform analysis on customer profile and usages to identify suspicious transactions and unusual calls patterns.
Suspend or resume services in systems."
"Engineer, Facilities Management",Singtel,Singapore,"Responsible for the delivery of efficient and cost-effective facility management and to SingTel’s property portfolio.
Perform Root Cause Analysis on Incident."
Agency: Data Analyst,Singtel,Singapore,"To support Service Delivery Executive (SDE) in facilitating resolution of orders disputes.
To be able to follow-up and check on disputed orders diligently and…"
Social Media Relations Executive,Singtel,Singapore,"We’re looking a Social Media Relations Executive who loves solving problems and creating long term customer relationships.
Be the voice of the customers."
"Project Management Admin Officer (Training Provided, 1 Year...",Singtel,Singapore,"Drive, align and adopt Project Management Methodology (PMM).
Plan and execute people engagement related events such as teambuilding and townhalls."
eShop Support (1 year Agency Contract),Singtel,Singapore,"Inventory management for all e-shop portals, including virtual inventory process during presales and major launches.
Minimum GCE ""O"" / ""A"" Levels / Diploma."
#SGUnitedTraineeships (SGUT) - Desktop Engineer,Singtel Group,Singapore,"This position works with various stakeholders and is responsible for installing, diagnosing, maintaining, and upgrading all hardware and equipment."
Billing Executive,Singtel,Singapore,"Process the requests for bill adjustments and waivers.
Manage the day-to-day operational and administrative tasks related to billing."
Fraud Specialist (Contract),Singtel,Singapore,"Perform analysis on customer profile and usages to identify suspicious transactions and high-risk calls patterns.
Suspend or resume services in systems."
Credit Management,Singtel,Singapore,"In-Charge of Accounts Receivable (AR) & Collection from SME Customers.
Attend Customer meeting to resolve issues.
Prepare Operation and management report."
Network Engineer,Singtel,Singapore,"Group Enterprise 5G technology team is seeking for a hands-on network engineer, who will be part of the software development team of the Group Enterprise 5G…"
Administrative Executive (6 Month Agency Contract),Singtel,Singapore,"Manage calendar, schedule meetings and book meeting venues, provide support to visitors.
Carries out administrative duties such as filing, printing, binding,…"
Operations Manager,Singtel,Singapore,"Lead and shape the Operations Support Team.
Track and manage Operations Expense (Opex) and Capital Expense (Capex).
Good communication and written skills."
"Associate, Data Analysis",Singtel,Singapore,"Increase customers’ product holdings and in-base penetration of Financial & Lifestyle services.
Data exploration & analysis to identify potential customers for…"
Sports Producer (1 year Agency Contract),Singtel,Singapore,"Work proactively with Associate Director, On-Air Promotion, to develop and devise creative solutions for key promotable."
Product Executive,Singtel,Singapore,"Awarded at the HR Fest Awards 2020.
Responsible to assist in providing strategic direction, product feature prioritization, and tactical execution, while…"
Software Application Tester (Agency Contract),Singtel,Singapore,"Incubent will be a quality assurance tester with experience in software application testing to assess and evaluate new applications, programs and software to…"
Cloud Opportunities,Singtel,Singapore,"Cloud technologies in AWS, Azure, Paas, Iaas, SaaS.
5G enterprise edge in domain expertise on Mobile networks and IP networks."
Project and Support Executive,Singtel,Singapore,"As an agile Business Analyst, defines improvements to business processes, gathers information to make decisions in designing customer journey, as well as…"
Real Time Analyst,Singtel,Singapore,Monitors multiple channels to ensure optimal staffing levels to meet performance Service Level targets this includes floor walk/real-time call outs of customer…
"Associate Engineer, Operation (Data Centre)",Singtel,Singapore,"Ensure incidents are responded and attended to, or escalated for 2nd/3rd level resolution based on criticality, impact and SLA."
Account Support Executive,Singtel,Singapore,"Perform deep dive analytics and reporting on mobile usage to provide insights to customers, operations and Management.
Support quotation and GeBiz submission."
Sales Support & Administrative Executive,Singtel,Singapore,"Provide and responsible for full spectrum of administrative support for various teams with staff/vendor contractors.
Management of email distribution lists."
Sales Executive,Singtel,Singapore,"Drive and achieve sales through active engagement of customers, sharing product knowledge, explains and demonstrates the different functions and features of the…"
"Specialist, Network",Singtel,Singapore,"Proactive monitoring and Incident/Fault management for Corp IP Infrastructure.
Ensure that technical and managerial escalation and communication to stake…"
Data Scientist,Singtel,Singapore,"Develop and deploy analytical solutions derived from the telco data.
Develop machine learning models for predictive and prescriptive analytics (regression…"
"Specialist, Systems",Singtel,Singapore,"The Desktop Engineer is responsible for managing day to day support of operational tasks, requests and incidents meeting customer’s requirements and Singtel’s…"
"Engineer, TV Engineering & Ops",Singtel,Singapore,Perform the role of a Support Engineer for the Singtel TV broadcast systems – support three data centres onsite or remotely.
"Engineer, IP & Broadband Engring & Ops",Singtel,Singapore,"Driving and planning the development of the IP Core Network.
Manage projects from both business and operational perspectives, including expanding IP Network…"
#SGUnitedTraineeships (SGUT) - Desktop Remote Support Engine...,Singtel Group,Remote in Singapore,This position works with various stakeholder and is responsible to provide 1st Level Remote Support is required to provide 1st level troubleshooting to users…
Engineer,Singtel,Singapore,"Carry out engineering planning (both pipeline and cable network) to support infrastructure project.
Track and analyse the performance of fibre and pipe…"
Accounts Executive,Singtel,Singapore,Perform monthly financial close processes by liaising with and verifying journal entries posted by Offshore Fin Ops team for Enterprise Sales (ES) and Business…
Telesales Executive,Singtel,Singapore,"Telesales sales achievement (Individual).
Achievement of sales target set by the company. i.e. SingtelTV GA (Contents, Broadband targets, Revenue and Churn rate…"
Service Delivery Manager,Singtel,Singapore,"The Cyber SDM acts as a trusted advisor for our customers, guiding them on their journey through the different stages of the service; onboarding, finetuning,…"
Associate Engineer,Singtel,Singapore,"Handled existing datacentre/exchange space & facility management, including but not limited to DC/AC power system, structure of the room, common room facility…"
Senior Engineering Officer,Singtel,Singapore,Co-ordinate closely with INOC (Integrated Network Operation Centre) on the timely fault clearing and service restoration of access and transmission equipment in…
Sales Operations Executive,Singtel,Singapore,"Hire Type : 6 months contracts under recruitment agency payroll.
The primary purpose of the position is to support the Sales Operations Department."
"Engineer, BCM",Singtel,Singapore,"Maintain proper documentation of Networks Group Business Continuity Management (BCM) Policy & Guidelines, Networks Group BCM Plan, Risk Analysis & Business…"
Credit Management Officer,Singtel,Singapore,"Daily Clearance of cheque received from customer and return from Bank.
Daily Reconciliation of payment file and bill payment stub."
Data Analyst,Singtel,Singapore,You will be responsible for the data analytics and system end-to-end process within the Supply Chain Management (SCM).
"Engineer, Facilities Engineering",Singtel,Singapore,Responsible for the delivery of efficient and cost-effective facility management and to SingTel’s property portfolio.
Account Manager,Singtel,Singapore,"To manage, create sales in a set given large local brand name customers to grow sales revenue, foster and build good CXO level customer relationship and…"
Engineering Officer,Singtel,Singapore,"Incharge of day to day operation and maintenance of 3G/4G/5G base stations and repeater systems.
Have an analytical mind, fast response and dedication to…"
Project Coordinator (Workplace Fitout),Singtel,Singapore,"Prepare draft Service Orders and Service Entries to ensure timely management’s approval of these documents.
Liaise with other departments, e.g., Finance and HR…"
#SGUnitedTraineeships (SGUT) - Systems Engineer,Singtel Group,Singapore,"This position works with various stakeholders and is responsible for more technical and in-depth deployment, troubleshooting, maintenance, upgrade and support…"
Solutions Manager,Singtel,Singapore,The primary responsibility of the Solutions Manager is to provide Pre-Sales Technical Solutions to support Singtel business in Singapore.
Contract Manager (Network Procurement),Singtel,Singapore,The Legal Contracts Manager reporting into Group Network Procurement works closely with both the Procurement Managers as well as the internal stakeholders from…
Outdoor Sales Executive,Singtel,Singapore,"Engage and interact with customers face to face.
Arrive at sales events on time to engage with customers.
Liaise with customers on pre and post sales for Mio TV…"
Project Manager,Singtel,Singapore,"Take care of both engineering planning and operation for the pipeline construction, cable diversion and circuit migration activities."
Accounts Executive (Agency Contract),Singtel,Singapore,"Assist finance manager in management reports preparation.
To perform basic analysis on financial reports.
To ensure fixed assets are capitalised in accordance…"
Product Manager,Singtel,Singapore,"Responsible for providing strategic direction, product feature prioritization, and tactical execution, while working closely with customers."
Data Centre Infrastructure Engineer,Singtel,Singapore,"Plan and manage multiple engineering projects from conceptual to handover, within budget, deliver on time, safety compliance and with quality."
RPA Consultant,Singtel,Singapore,"Responsible to deliver Robotic Process Automation (RPA) by designing RPA process workflow, programming RPA software, ensuring quality assurance of RPA codes and…"
"Associate Engineer, Headend",Singtel,Singapore,"Support mission critical Singtel TV 24x7 Headend operations for Singtel TV, TV GO, CAST, Singtel Business TV, Optus Sport and Cross-carriage content."
Technical Specialist,Singtel,Singapore,"Handle 24x7 escalations from the Operations team and provisioning team on corporate IP network.
Responsible for troubleshooting and timely resolution of faults…"
Digital Sales Executive,Singtel,Singapore,"Telesales sales achievement (Individual).
Achievement of sales target set by the company. i.e. Mobile New and Recontract, Fibre and SingtelTV GA (Contents,…"
Cable Station Manager,Singtel,Singapore,The Cable Station Manager is responsible to oversee the operation of submarine cable landing stations and the submarine cable system equipment that are located…
Senior Associate Engineer,Singtel,Singapore,Supervise and oversee the Managing Agent in the provision of property management services to SingTel premises and tenanted space.
Senior Associate Engineer,Singtel,Singapore,Supervise and oversee the Managing Agent in the provision of property management services to SingTel premises and tenanted space.
"Manager, Major Incident Management",Singtel,Singapore,"Command Centre (incident managers, incident coordinators) working with Shift Operation Manager in coordination of end-to-end incident management, ensuring that…"
Data Centre Associate Engineer,Singtel,Singapore,"Perform shift duty to support 24x7 DC Operations or be on 24x7x365 stand-by duties for emergency.
Perform Incident escalation (Ensure incidents are responded…"
Cybersecurity&Incident Response Analyst,Singtel,Singapore,"Responsible for the daily real time monitoring and analysis of security events /threats from multiple sources.
Determine cause and extent of breach."
Talent Acquisition Manager,Singtel,Singapore,"Manage the end-to-end recruitment process, including contact with hiring leaders, screening & selection, interviews (in-person, phone and video), offer proposal…"
Software Developer,Singtel,Singapore,Bring in your experience in building scalable and repeatable platforms to make every component of the platform modular by design with industry grade security.
RPA Developer,Singtel,Singapore,"The RPA developer is a member of the People Technology Team responsible for the creation, design, development, and implementation of RPA systems."
Sales Specialist,Singtel,Singapore,"To grow the business through new acquisitions, win-back of competitor accounts, and expanding customer expenditure through upselling of services."
Regulatory Operations Executive (Agency Contract),Singtel,Singapore,"Analysing new and existing customers’ profiles and transactions in the relevant sanctions, money laundering (ML) and terrorism financing (TF);"
Credit Management Executive,Singtel,Singapore,"Manage a small business process outsourcing (BPO) team from India.
Attend Customer meetings to resolve issues.
Prepare Operation and management report."
"Team Head, Channel Sales and Development",Singtel,Singapore,Develop a competent and result-oriented channel sales team to achieve company’s financial objectives in Billable Revenue (BR) and Contract Value (CV).
Senior Account Support Executive,Singtel,Singapore,"To support the Account Managers and Directors (Sales Team) in managing the accounts assigned, handling customers’ enquiries, escalations, and sales activities."
Tender Manager,Singtel,Singapore,"Support maintenance, changes and enhancement of end-to-end tender process and all corresponding documentation in line with Procurement policy requirement and…"
"Manager, PMO",Singtel,Singapore,"Facilitate strategic alignment of projects and initiatives in Group IT.
Setup and standardize project initiation, selection and prioritization governance and…"
Product Manager (Cloud & Voice Service),Singtel,Singapore,"Develop product features, pricing plan, and business processes for new services.
Engage partners and work with Engineering, IS and Operations on the development…"
Planning Manager,Singtel,Singapore,"Lead in the planning and project management of new or existing mobile core network, including technology selection, capacity planning, service rollout and…"
Product Manager - Managed Services,Singtel,Singapore,This position is responsible for developing and managing the Managed Service for Singapore domestic businesses as well as the regional market.
Credit Management Officer (Agency Contract),Singtel,Singapore,"Daily newspaper cutting for Liquidations.
Perform credit reviews and follow up on accounts of bankrupt customers to minimise debt exposure."
"Associate Director, Corporate Facilities",Singtel,Singapore,"Oversee external service providers to ensure a consistent level of service standard, including carrying out periodic audits to maintain a low fault rate and…"
Assistant General Counsel (M&A),Singtel,Singapore,Singtel is looking for a Senior Legal Counsel / Assistant General counsel to provides legal advice and support to Singtel Group’s transactional M&A activities…
Talent Acquisition Associate (Fixed Term Contract),Singtel Group,Singapore,"To support the end-to-end recruitment support – pipeline development and onboarding for recruitment.
Update the dashboard of respective business units assigned…"
Program Support Executive,Singtel,Singapore,This role requires the candidate to possess effective communication qualities with the ability to be able to implement and manage the new working model and any…
"Manager, OSS Devt",Singtel,Singapore,"Responsible for planning, implementation, and operations of the Operations Support Systems (OSS) solutions: service assurance (fault, performance, and service…"
Service Operations Engineer,Singtel,Singapore,The role of the Service Operations Engineer is to ensure the operations and maintenance of the Mobile Value-Added Service (VAS) system meets the required…
Manager,Singtel,Singapore,"Planning and project management of new or existing mobile payment services, including technology selection, capacity planning, service rollout and service…"
System Planning Manager (ISP),Singtel,Singapore,"Manage day-to-day operational aspects of a project and scope including manages project budget (CAPEX), conducts periodic project reviews, monitors receivables."
Product Manager_Agency Contract,Singtel,Singapore,"Product Manager is responsible for product planning, development and user experience throughout the product lifecycle."
Business Analyst,Singtel,Singapore,This role requires the individual to determine requirements and deliver data-driven recommendations and reports to executives.
Business Development Manager,Singtel,Singapore,"Business Development Manager for Roaming Wholesale (B2B Sales).
Devise strategies and plans for wholesales roaming business.
Bachelor’s degree in any field."
"Senior Associate Engineer, Broadcast Engineering",Singtel,Singapore,"Support Engineer for the Singtel TV broadcast systems.
Work closely with the broadcast support and operations teams; and external parties in problem…"
Creative Project Management Manager (Agency contract),Singtel,Singapore,"Create, optimize, and govern workflow and processes for Consumer Marketing Communications - from cross sell team, performance marketing team, GTM team to…"
Technology and Solution Specialist,Singtel,Singapore,"Driving local and relevant Technology and Solutions across SME business segment.
Sales experience in selling Technology solutions including Networking, Servers…"
Product Manager (Commercial),Singtel,Singapore,"Responsible for product performance and profitability for cloud connectivity services (AWS, Azure, GCP etc) and software defined network offering."
Internal Audit Manager,Singtel,Singapore,"The Audit Manager is a single contributor who has the responsibility for planning, engaging and driving critical and complex internal audit projects and…"
"Associate, Corporate Transformation (Accounting Background)",Singtel,Singapore,"The RPA developer supports senior RPA developers/Director in development, and implementation of RPA systems, script and deliver approved solutions for…"
"Engineer, Mobile Engineering & Ops",Singtel,Singapore,"Plan, design and execute project plans.
Gather functional requirements, develop technical specifications and define project scope."
Wireless Specialist,Singtel,Singapore,"Plan, design, install, test & implement systems in accordance to specifications & service level.
Where relevant, perform the necessary system programming &…"
"Team Head, Account Management",Singtel,Singapore,"Manage and create sales, together with team members, in SME Mid-market segment to grow sales revenue.
Foster and build good CXO level customer relationship and…"
"Project Manager, Mobile Network Access",Singtel,Singapore,"Reporting to the Director, Mobile Network Access, you will lead a team of Associate Engineers to manage Singtel Mobile’s Radio Access Network (RAN) site…"
"Manager, Radio Network Quality",Singtel,Singapore,"Administration of the radio automation modules (3G/4G/5G).
Main liaison with internal and external stakeholders (eg: Analytic, network intelligence tool vendors…"
"Manager, Business System support",Singtel,Singapore,The individual is a member of a support unit that work closely with IT and vendors in improving and managing the performance of systems that customer serving…
Threat Intelligence Analyst,Singtel,Singapore,"Monitor and analyse threat intelligence from open and commercial sources for attack campaigns, new vulnerabilities, IOCs and threat actor groups and their TTPs."
"Senior Manager, Third Party Risk Management",Singtel,Singapore,"The position will be part of the Group Governance & Compliance (GGC) team within Group Cyber Resilience (GCR).
Aging report of risk closure."
"Executive, Digital Platform",Singtel,Singapore,"Liaise with cross functional team to gather project requirement and create user story.
Drive Sprint’s Cadences which include Daily stand up, Grooming session…"
Network Specialist,Singtel,Singapore,"Responsible for managing Critical internal infrastructure which involves Routers, Switches, Firewalls, Load-balancers, servers, virtualization, security tools."
Internal Audit Manager - F&O,Singtel,Singapore,The Internal Audit Manager is responsible to perform risk-based assurance reviews and internal control advisory activities for Singtel Group.
Marcom Executive (Agency contract),Singtel,Singapore,"Develop, enhance, and execute programs to connect our customers and drive revenue across platforms, on both online and offline environment, for core Singtel…"
Senior Customer Care Officer (Home Premium Services),Singtel,Singapore,"Awarded at the HR Fest Awards 2020.
Objective: Interacts with customers through phone to provide effective service to every customer by building a personal…"
Data and Process Analyst,Singtel,Singapore,"Establish new and review existing processes, driving changes to optimise business processes.
Identify opportunities for process optimisation & automation to…"
