Job Title,Company,Location,Job Description
"Engineer, Broadband & SingNet Operations",Singtel,Singapore,"Responsible for Change, incident, and problem management and ownership from technical aspect.
Take lead in handling complex issue and chronic problem, identify…"
Legal Counsel,Singtel,Singapore,"The Legal counsel reports to Assistant General Counsel Singtel Legal & Director Corporate Functions, SG Data Centre Company to provide legal support to SG Data…"
Channel Sales Manager,Singtel,Singapore,"This is a Sales Business Manager role targeting the Maritime market for both Singapore and overseas accounts.
Drive promotions and update sales tools."
Machine Learning Engineer,Singtel,Singapore,Develop optimal engineering solution for automating and monitoring production grade machine learning and data-driven initiatives; supporting Batch and Real-time…
"Director, Network Operations (130874)",Singtel,Singapore,The Director for Network & Security Operations will provide the necessary leadership and direction to deliver reliable and quality network and security services…
Digital Support Team Lead (Cust Care),Singtel,Singapore,"Strong supervisory, performance management and workforce planning skills.
Problem solving/conflict resolution skills, i.e. able to understand and resolve issues…"
Experience Design Manager,Singtel,Singapore,"Specifically, they will have a passion for driving customer-centric thinking and are seasoned practitioners in designing User Experience (UX) across channels…"
#EG Software Engineer (Java/J2EE),Singtel Group,Singapore,"The Software Engineer is responsible to gather, analyses and formalize user’s business requirements and processes, evaluate on feasibility of implementation and…"
HRIS Manager (Employee Central & Data Management),Singtel,Singapore,"Awarded at the HR Fest Awards 2020.
The HRIS Manager, Employee Central (EC) & Data Management is responsible for the completeness, accuracy and timeliness of…"
"Associate Consultant, Systems",Singtel,Singapore,"This role is responsible for managing day to day support of operational tasks, requests, incidents and changes meeting customer’s requirements and Service Level…"
Sharepoint Developer,Singtel Group,Singapore,"Gather, analyse and formalise user’s business requirements and processes, evaluate on feasibility of implementation and manage scope of project."
Contracts Manager (IT Procurement),Singtel,Singapore,The Contracts Manager reporting into IT Procurement is required to work closely with both the Procurement Category Managers as well as the internal stakeholders…
Satellite Operations Manager,Singtel,Singapore,"Lead team of specialists at Satellite Command and Control Centre.
Perform satellite flight operations planning and satellite manoeuvres."
Service Migration Engineering Officer,Singtel Group,Singapore,"Fiber cable preparation, patching, splicing and migration work.
Perform night cable migration work.
NITEC or Higher NITEC in Engineering, Information Technology…"
Security Planning Manager,Singtel,Singapore,Manage infrastructure security deployment projects involving centralised security solutions such as SIEM /VDI/PIAM/SOAR/MFA/FW Automation/VPN/IPS/VA/EDR/NDR…
"Manager, Product Development",Singtel,Singapore,Grow payment capabilities and cross-network merchant acceptance by leveraging on dominant payment schemes and exploring new schemes; such as but not limited to…
Assistant General Counsel (Litigation),Singtel,Singapore,"To provide legal direction and support, in particular litigation management, to various business units within the Singtel group of companies in Singapore and…"
"Senior Consultant, Systems",Singtel,Singapore,"Respond promptly to incident, investigate & provide temporary &/or permanent resolution of incidents escalated.
Ensure service level meet requirement."
Senior Software Engineer,Singtel,Singapore,The successful candidate is one who has deep understanding the architecture and design of the 5G business services platform and contribute on the customer…
"Lead, IT BP, Business Portfolio Mgt",Singtel,Singapore,The role requires extensive engagement with senior management and hence strong negotiation and influencing skills are a must.
"Associate Engineer, Cpaas Products (1 Year Agency Contract)",Singtel,Singapore,"Provisioning of Cpaas related products which include integration of telephony, mobile services with Microsoft Teams, Mobile Interactive Voice Response (MIVR),…"
"Associate Director, Group Risk Management (anti-bribery and...",Singtel,Singapore,"Leading the initiatives in developing and establishing a ‘fit for purpose’ compliance programme framework for the Group, and drive implementation across the…"
"Director, Group Strategic Communications",Singtel,Singapore,"The incumbent will be tasked to lead the company’s communications efforts.
He/ she should demonstrate the ability to drive positive media coverage, manage media…"
"Engineer, Service Delivery (Direct Contract)",Singtel,Singapore,The Service Delivery Engineer is responsible for service provider Network migration projects by working closely with Transport/Network Engineering team.
"Lead Consultant, Systems",Singtel,Singapore,"The System Lead is responsible for managing day to day support of operational tasks for teams under his/her charge and includes requests, incidents,…"
Senior Customer Relationship Executive,Singtel,Singapore,"Translate the company’s service vision, corporate objectives and core values into handling plan for each customer."
System Planning Manager (SD WAN),Singtel,Singapore,"Systems Planning Manager for managed SD-WAN platform.
Support the design and build of headend infrastructure.
Work with support teams and pre-sales."
Contract Manager (Group Enterprise),Singtel,Singapore,"Prepare, negotiate and advise on all aspects of enterprise customer / supplier / partnership contracts as well as the Company’s standard terms."
Senior Delivery Manager,Singtel,Singapore,"Build-Run teams are created per problem domain and continuously deliver value in the form of larger products, incremental enhancements, or fix and maintainence…"
"Head, Group Internal Audit, NCS",Singtel,Singapore,"Group Internal Audit is part of the corporate governance structure of Singtel Group, reporting functionally to the Singtel Audit Committee and administratively…"
"Legal Counsel (Network, IT, Property)",Singtel,Singapore,"Draft, review and negotiate a wide variety of contracts with particular focus on IT, mobile networks, and property related transactions."
Finance Executive,Singtel,Singapore,"Participate in systems implementation for new business entities.
Assist to carve out historical financial information relevant to the new business and support…"
Customer Lifecycle Management Manager,Singtel,Singapore,"Increase customers’ product holdings and in-base penetration of Financial & Lifestyle services.
Leverage on data analytics to conceptualize and design targeted…"
Financial Systems Associate/Manager,Singtel,Singapore,"Maintain SAP master data for Cost Centres, Profit Centres and Internal Orders.
Support month end closing activities/issues including various system interface."
Transmission Operations Engineering Officer,Singtel Group,Singapore,"Fault clearing and service restoration of access and transmission equipment.
Troubleshoot fault related to access and transmission equipment."
"Product Manager, Digital Platform",Singtel,Singapore,"Understand the business strategy, goals, and initiatives.
Understand the customers’ needs and experience, and continually test your assumptions."
"Manager, Group Risk Management ( Risk Strategy & Assurance)",Singtel,Singapore,The Risk Strategy & Assurance pillar is mandated to assist Singtel in accomplishing its business objectives by adopting a systematic and disciplined approach to…
"Associate Engineer, Mobile Network Access",Singtel,Singapore,"Meet Building Owners (BO) to understand their change requests related to mobile site, assess the impact and jointly agree on the scope of work."
Test Environment Delivery Manager,Singtel,Singapore,"We are looking for DevOps kind of profile who will manage the Test Environments in cloud.
This role is for the Corporate Systems & Services - Test Management…"
Manager (RPA Consultant),Singtel,Singapore,"As part of Networks, Singtel the sole purpose of this role is to improve and transform business performance through automation methodologies like RPA."
"Manager, Group Risk Management (Business Continuity Manageme...",Singtel,Singapore,"Being part of the Singtel Group Risk Management (GRM), the role provides support to the development and advisory of Business Continuity Management to Business…"
Test Manager (Automation),Singtel,Singapore,The Test Manager - Automation is responsible for the delivery of automation and test tools testing services across all Singtel based TMO project engagements.
"Senior Manager, Service Management",Singtel,Singapore,"The Service Delivery Manager will act as the SPOC, for Customer engagement on service delivery matters, and will be part of the Client Delivery Engagement,…"
Workplace Fitout Project Manager,Singtel,Singapore,"Deliver a high quality, well-designed and productive workplace for staff based in Singapore and overseas.
Work with designers and contractors to plan, design…"
Network Operation Centre Manager,Singtel,Singapore,"Plan, manage and oversee the day-to-day NOC operation across 2 sites to provide (24 x 7) round the clock network monitoring for Mobile, Broadband, TV, Fixed…"
#Market Maker,Singtel Group,Central Business District,"You will manage large scale deals from pitch to closure.
Deal Strategist: lead Opportunity Origination, Win Strategies, Price to Win sessions, Black Hat reviews…"
"Director, Data Solutions",Singtel,Singapore,The purpose of this role is responsible to manage Singtel Data Solutions team comprise of internal IT staff and several IT service providers to deliver Business…
"Manager, Internal Communications",Singtel,Singapore,"Develop and drive communications that engage and inspire employees around the company’s mission, principles, and strategy."
Delivery Manager,Singtel,Singapore,"Establish baseline and control project scope from inception to closure.
This includes managing the requirements gathering phase, solution design phase and…"
"Consultant, Network",Singtel,Singapore,"24 by 7 Tier 2 technical support team for Software Define WAN, Network Function Virtualization, Cisco Router Network, Juniper Router Network."
Pricing Manager,Singtel,Singapore,"The B2B pricing manager is responsible to support the business in achieving the revenue target in the SME market.
Perform pricing evaluation of potential deals."
"Associate Director, 5G Enterprise Edge (#5G)",Singtel,Singapore,This is a newly created role and the successful candidate will be responsible for the overall aspects of Product and Program Management for the 5G Enterprise…
"Manager, Group Strategic Communications",Singtel,Singapore,"The ideal candidate should have a passion for storytelling and writing, and preferably have a good understanding of the telecom, media and technology industries…"
"Lead Consultant, Network",Singtel,Singapore,"Analyze technical needs, requirements, and state of the network’s infrastructure design, integration, and operations."
Software Engineer,Singtel,Singapore,"Design, develop and maintain enterprise grade, highly scalable and high performing software solutions that meet both functional and technical requirements…"
"Operations Manager, Corporate Mobile Ops",Singtel,Singapore,"Lead a team of CSE to manage daily operations in the aspect of people, process, system, service quality, customer experience, resources optimization, cost…"
Global Account Manager,Singtel,Singapore,"Foster and build good customer relationship at all levels for revenue growth and customer retention.
Work with Solution Manager & Sales Specialists to propose…"
e-Commerce Marketing Manager,Singtel,Singapore,"Develop marketing plan for the Digital Sales channel to maximise sales.
Work with IT to leverage on SEM, SEO and affiliate marketing to drive qualified traffic…"
"Manager, Threat Prevention - SOC",Singtel,Singapore,"Delivery of network and cloud-based security services including but not limited to Managed Next Gen Firewall (NGFW), Distributed Denial of Service (DDoS), Web…"
Product Manager (CPaaS Messaging),Singtel,Singapore,"Responsible for the product management of the Communication Platform As A Service (CPaaS), a platform that support enterprise customers to integrate real-time…"
Associate Product Owner,Singtel,Singapore,"As an Associate Product Owner, you will report to the Senior Product Owner and drive the execution of the vision & strategy for the digital mobile app, portals…"
"Manager, Corporate Facilities",Singtel,Singapore,"Review and familiarized with all M&E related project design, contract documentation, contractor submission, procurement documents, tender package, show drawings…"
Lead Security Consultant,Singtel,Singapore,"This role is to provide support to Singtel ASOC Infrastructure, and assist the Managed Security Devices (MSD) Delivery Teams with customer delivery."
Network Planning Manager,Singtel,Singapore,"Design, plan and setup/expand new/existing SingTel Private IPVPN / MPLS network, and Global Internet Network.
This will include ensuring that design conforms to…"
Digital Automation Engineer,Singtel,Singapore,"Awarded at the HR Fest Awards 2020.
The role will be responsible for end-to-end project delivery of an automated process, which include requirement gathering,…"
Bid Manager,Singtel,Singapore,"Lead and manage end-to-end bidding pursuit process.
Be the overall-in-charge of RFP document development, preparation and to ensure high quality proposals are…"
"Director, Digital Channel",Singtel,Singapore,This role of Lead Product Owner is a key leadership position focused on providing thought leadership in developing Singtel’s B2B next-generation digital channel…
"Associate, Billing Management",Singtel,Singapore,"Responsible to ensure that Roaming and TV services provided to the customers and operators are billed completely, accurately and in a timely manner."
"Consultant, IT Security",Singtel,Singapore,"Work closely with the Project Managers of assigned projects on implementation of security product technologies (e.g. FW, IPS, EPS, PAM, CA, DBSec, etc.)."
Project Manager (WAN Telco),Singtel,Singapore,"(PMM) that covers Initiation, Define, Organise & Plan, Implement & Control and Handover & Closure.
Lead the project team members (matrix reporting) that are key…"
"Engineer, Digital & Software Engineering",Singtel,Singapore,"Design, develop and maintain software solutions that meet both functional and technical requirements including security requirements."
Security Development Engineer,Singtel,Singapore,"The candidate will build, configure and manage systems that will be used for cyber-related attack and defense scenarios."
Digital Channel Manager,Singtel,Singapore,This role of Digital Channel Manager is focused on in developing Singtel’s B2B next-generation digital channel for customer engagement across various Singtel…
Finance Manager,Singtel,Singapore,"In charge of Finance and Accounting of Business unit ensuring prompt monthly and quarterly closing, complying with FRS and Group policies."
Data Migration & Application Testing Engineer,Singtel Group,Singapore,The Data Migration Application Engineer is responsible to design and develop data migration scripts based on data migration requirements and ensure data…
Digital Project Manager,Singtel,Singapore,"Drive solution detailing and problem solving around solution implementation.
Define detailed solution based on problem statements."
"Associate Director, Graduate Talent Programmes",Singtel,Singapore,The successful candidate is expected to make Singtel’s graduate talent programmes competitive in the market and more impactful as part of Singtel’s long-term…
"Engineer, Cyber Security",Singtel,Singapore,"Monitor security tools to detect security events & incidents; Report, escalate and investigate any security breaches to relevant stakeholder and SOC Director."
"Associate, Credit Management",Singtel,Singapore,"Perform credit reviews on both consumer and corporate delinquent accounts to minimise bad debts.
Take immediate legal actions to recover debt."
"Manager, Group Risk Management (Gp Enterprise)",Singtel,Singapore,Ensuring the continued relevance of risk management policies and protocols through periodic reviews and strategic updates.
Scrum Master,Singtel,Singapore,"Digital Technology (Group IT) organization comprises of functional chapters (Engineering, DevOps, Testing, Delivery management, Service Management, Architecture…"
Azure Infrastructure Engineer,Singtel,Singapore,"Contribute to multi cloud architecture design and engineering.
E.g. AWS, Azure and GCP.
Using Infrastructure as Code for infrastructure provisioning (e.g.:…"
Software Engineer (Dash),Singtel,Singapore,"The Microservices/Server Developer (PF4) will be part of the development team in Digital Platforms, Group Technology and Networks supporting the Singtel Dash…"
Senior Software Developer,Singtel,Singapore,"In addition, engineers are part of the development practice, specialized in areas like Java 11, Spring 5, reactive design methodology and AWS."
"Manager, Data Partnerships & Tech",Singtel,Singapore,"Set up a framework for the management of analytics projects (i.e. gathering requirements & scoping, handover to deployment, and monitoring), and to introduce…"
Senior Business Continuity Manager,Singtel,Singapore,"Engage domains to review the DR readiness of GIT-owned or managed systems in Singapore and Australia.
Facilitate the identification of threats that affect the…"
Microservice Developer,Singtel,Singapore,"Microservice developer using Spring Boot framework.
Design and develop functions that meet both business requirement and technical requirements including non…"
IT Technical Manager (Architecture),Singtel,Singapore,"Creates and owns the Team Backlog(s), User Stories and aIterations, Planning, overseeing development stages, Contributes to Vision, Roadmap and ROI of the…"
Lead Engineer (1-Yr Direct Contract),Singtel,Singapore,"Design and lead development of solutions to meet business requirements.
Drive standardization and best practises during implementation of solutions."
Senior Test Engineer (Automation)(1-Yr Direct Contract),Singtel,Singapore,The Senior Automation Test Engineer is responsible for the delivery of testing services across Singtel development initiatives where TMO has been engaged.
"Associate/ Manager, Interconnect, Regulatory",Singtel,Singapore,"As the Senior / Manager for Interconnect, you would ensure accurate and timely interconnection billing and settlement.
Basic knowledge on Contract Law."
"Senior Manager, Network & Security",Singtel,Singapore,"To produce an integrated solution covering all areas and in line with the TI strategy.
Gathering Infrastructure requirements for all projects with…"
"Mgr, Dmd & Release Mgmt, IT Biz Partner",Singtel,Singapore,"Collaborate with demand managers to plan, prioritize and manage Capex & Opex demands:
Ensure optimal resource utilization through efficient budget allocation…"
"Engineer, Service Delivery (1 Year Direct-Contract)",Singtel,Singapore,"Product evaluations, upgrades implementations, project tasks for systems/network expansion, support, and monitoring systems."
Database Administrator,Singtel,Singapore,"The Database Analyst is responsible for managing day to day support of operational tasks, requests, incidents and changes meeting customer’s requirements and…"
Systems Developer (1-Yr Agency Contract),Singtel,Singapore,"Responsible to build infrastructure management system for cloud and self-hosted environment.
In this role, you will need to config and build software used for…"
Technical Project Manager,Singtel,Singapore,"The Technical Project Manager is part of the Cloud Delivery team that is responsible for managing Cloud Solution (Public, Private or Hybrid) Delivery projects…"
"Director, Predictive Analytics",Singtel,Singapore,"Leading and nurturing a high performing team of data scientists and machine learning engineers.
Accelerate data science and machine learning engineering…"
.Net Full Stack Developer (1-Yr Agency Contract),Singtel,Singapore,"Work with development teams and product managers to ideate software solutions.
Build the front-end of applications through appealing visual design."
"Senior Specialist, Information Security (111702)",Singtel,Singapore,We are looking for a Senior Specialist in Information Security who is responsible for vulnerability assessment and penetration test.
Cloud Security Engineer,Singtel,Singapore,"To research, develop, implement, test and review operation information Security setup and Compliance, such as Identity Management, Role Based Access Management…"
Software Engineer - Infrastructure Management,Singtel,Singapore,"We are seeking for a hands-on Engineer for Infrastructure automation, who will be part of the software and infrastructure team of Group Enterprise 5G/IOT…"
"Marketing Executive, Mobility Product",Singtel,Singapore,"Creation of new managed device services to enable end-to-end device management support.
Support the day-to-day marketing and operations of existing device…"
Business Development Manager - 5G/ICT/Telco (ID130771),Singtel,Singapore,"Engage business development with customers aligned with Singtel 5G strategies to drive new growth areas, acquiring new businesses, new customers and profitable…"
"Senior Consultant, Network",Singtel,Singapore,"Deploy, deactivate and decommission infrastructure components, verify performance through installation tests, and resolve basic infrastructure deployment issues…"
"Senior Analyst, IT (Successfactors)",Singtel,Singapore,"Design and develop solutions to meet business requirements, with SuccessFactors as the main platform.
Adopt best practices during implementation of solutions."
Process Manager,Singtel,Singapore,"This position is responsible to develop and maintain the Business Products suite of processes, drive process KPIs definitions and management, and lead process…"
"ServiceNow, Automation Engineer",Singtel,Singapore,"Build and maintain System and Service Automation solution, perform testing, deployments and production release.
Integrate ITSM system with API platform."
Associate Data Scientist,Singtel,Singapore,Conceptualize data use cases with business users and conduct tech assessment and define measurements of success for data use case.
"Executive, Digital Platform (Agency Contractor)",Singtel,Singapore,"To be part of the team striving towards Digital Excellence.
You will be working with a team of like-minded individuals to provide Production Support on all the…"
"Product Marketing Manager, 5G",Singtel,Singapore,The role is critical to implement 5G marketing strategies to deliver financial and market share targets and evolve in tandem with the hyper-competitive business…
"Planning Engineer, Mobile IP Engineering",Singtel,Singapore,"Driving and planning the development of the Mobile IP Core Network.
Plans, develops and executes project work plans for network expansion and upgrades and…"
Business Analytics Manager,Singtel,Singapore,"We are looking for individual who will proactively and independently provide deep dive insights and make recommendation to support executive decisions, identify…"
# Sales Lead,Singtel Group,Singapore,"As a Sales Lead for Public Service - Education , you are responsible for leading the team to drive NCS sales, including account penetration, prospect…"
Senior Project Manager,Singtel,Singapore,"The Project Manager is part of the 5G/IoT Product Management & Delivery team that is responsible for managing technology projects and their scope, time and cost…"
Senior Systems Developer,Singapore Telecommunications Limited (Singtel),Singapore,"Responsible for the planning, design and implementation of infrastructure management system for cloud and self-hosted environment."
Senior Digital Project Manager,Singtel,Singapore,"Drive solution detailing and problem solving around solution implementation.
Drive and own definiation and formalisation of detailed E2E Process for the process…"
Agile Coach,Singtel,Singapore,Agile coach will work collaboratively within the agile chapter to drive Agile transformation for the business and support digital cross-functional teams to…
Performance Marketing Manager (Agency Contract),Singtel,Singapore,"To drive new subscriber growth through paid media channels.
To work with media agencies to set the yearly media strategy for various ‘always on’ campaigns."
"Product Marketing Manager, Roaming",Singtel,Singapore,The product manager is responsible for new product development and execution for consumer Roaming services for Postpaid and GOMO subscribers.
"Director, Data Engineering",Singtel,Singapore,"Define and govern Big Data strategy, architecture and roadmap.
Drive, lead and align new capabilities in the area of Big Data and Data Integration across…"
Lead Full Stack Engineer (1-Yr Direct Contract),Singtel,Singapore,The Lead Full-stack Engineer will be part of our development team that has strong experience in agile development and in-depth knowledge of digital solutions.
Carrier Account Manager/ Snr Carrier Account Manager,Singtel,Singapore,"Manage Singtel and Optus IDD traffic delivery cost as well as bringing in transit businesses for both companies, among others.
A degree in any discipline."
"Manager, Business Analytics",Singtel,Singapore,"Apply data analytics and business intelligence to support business strategies and goals.
Provide business insights on customer acquisition, service usage,…"
