Job Title,Company,Location,Job Description
Firmware Architect For Singapore location,Wipro,"Noida, Hyderabad/Secunderabad, Singapore", Hands on experience in C. Linux Kernel Development
Firmware Engineer For Singapore location,Wipro,"Bangalore/Bengaluru, Singapore, India"," Hands on experience in C. Linux Kernel DevelopmentDebugging experience with JTAG, GDBFi..."
C-Sharp,Finsurge Pvt.Ltd,"Singapore, Malaysia", Roles and Responsibilities Financial Software DeveloperRequirementsDegree in Computer S...
"Software Engineer, iOS",CAROUSELL TECHNOLOGY PRIVATE LIMITED ,Singapore, 4+ years of experience developing iOS applications (Objective-C and / or Swift) Strong ...
"Director - Strategy & Business Design Financial Services, Singapore",Cucumber Consultants  ,Singapore, Our client is a top 10 global management consulting firm. They bring cutting-edge ideas...
Vice President - Sales - Analytics/Data Engineering/Cloud,TalentCo Search Pvt Ltd,"Bangalore/Bengaluru, Singapore,  Middle East", Required Technical & Professional Expertise : - Minimum 12+ years of experience in Sale...
HR Payroll Manager,VHR PROFESSIONAL SERVICES PRIVATE LIMITED    ,"Singapore, Canada, United Kingdom (UK)"," Develop systems to process payroll account transactions (e.g. salaries, benefits, garni..."
