Job Title,Company,Location,Job Description
Systems & Project Executive,Singtel,Singapore,"At Singtel, we believe in the strength of a vibrant, diverse and inclusive workforce where backgrounds, perspectives and life experiences of our people help us innovate and create strong connections with our customers. We strive to ensure all our people practices are non-discriminatory and provide a fair, performance-based work culture that is diverse, inclusive and collaborative.
Join us and experience what it’s like to be with an Employer of Choice*. Together, let’s create a brighter digital future for all. *Awarded at the HR Fest Awards 2020.


System Operations

Being the business owner of several dedicated systems, the Executive will work with the Supervisor/Team Leader in managing vendor and IT Departments to ensure reliable performance from the systems
End-to-end management of all incidents initiated from operations and order fallout escalations. Key role is to track, respond and to coordinate with IT and various stakeholders to resolve incidents in a timely manner
Devise, plan and execute improvement efforts, processes to resolve system issues etc.
Fault resolution – Ensure IT conduct root cause analysis and implement long term solution/preventive measures
Ensure adherence to IT security, audit policies and any matter related to governance and IT framework

Project Management/System Enhancement
The Executive will work closely with stakeholders in designing and conceptualizing new systems/system enhancements (IT skills not required) to deliver an effective and efficient system that meets users’ needs and management objectives. You will support/work with the respective managers in implementing the following:
Gather and scope requirements with requestors to develop user requirement document
Manage, support & ensure the solution delivers according to user change request specifications (including system design, features and functionalities)
Ensure end to end solutions were fully thought through with IT before requirement signoff
Clarify discrepancies and gaps found in Impact Analysis (IA) document
Develop/review test plan and test cases for system enhancement (change request)
Manage/conduct UAT to ensure all functionalities delivered accordingly to specifications as well as defect management
Bridge any gap detected between IT & request owners to find the optimal solution
Perform sanity test before production deployment to ensure software stability during wee hours or midnight
Manage implementation and post-implementation activities such as training, onsite support, conducting post-mortems, benefit analysis, incident monitoring till closure
Manage deliverable schedule & resource. Tracking the progress of all deliverables and provide regular updates to the request owners via emails or meetings
Produce documentation for all deliverables such user manual, solution designs, test plan/results, etc and deposit them in the correct depository
Requirement
Minimum Diploma in any discipline – preferably Business or IT related
Able to work with a minimal supervision
Able to perform & support testing during at wee hours or midnight or weekends
Good interpersonal skills and able to work in a team
Good oral and written communication skills. Ability to read and speak mandarin will be an added advantage
Possess positive attitude and customer-focus mindset in delivering deliverables
Possess challenger-spirit in handling assigned tasks & situations
Proficient in MS Office & Visio Applications"
#SGUnitedTraineeships (SGUT) - Desktop Engineer,Singtel Group,Singapore,"Realise your full potential with Asia's leading communications group. While we take pride in our 140-year heritage, our philosophy is to always look forward and evolve. Today, we are a leader in cutting-edge ICT innovation and digital advances, powered by a vast network of offices in countries and territories across Asia Pacific, the Middle East, Europe and the USA. Come be a part of our dynamic organisation as we create the infocomms landscape of the future.


ABOUT SGUNITED TRAINEESHIPS
Singtel Group is partnering with WSG to offer SGUnited Traineeships to recent graduates, to equip them with work experience and boost their employability. We have a broad range of opportunities across business, corporate functions and ICT. These traineeships will equip you with practical work experience in our operations, with a blend of on-the-job training and e-learning through our digital platform, #CURIOUS, which features >150,000 virtual learning courses.

More information on the program can be found under www.wsg.gov.sg/SGUnitedTraineeships-Trainees.html

NCS is a leading information and communications technology (ICT) and communications engineering services provider across the Asia-Pacific region. It is headquartered in Singapore and a wholly-owned subsidiary of the Singtel Group.
NCS has in-depth domain knowledge and unique capabilities that create business value for customers. We offer a broad range of services, including consulting, systems development and integration, business process outsourcing, infrastructure management and solutions, and technology solutions.
We deliver end-to-end ICT solutions to help governments and enterprises realise business value through digital transformation and the innovative use of technology.

Traineeship Description:
This position works with various stakeholders and is responsible for installing, diagnosing, maintaining, and upgrading all hardware and equipment

Skills and Competencies to learn:
To gain hands-on experience on Basic Configuration and Networking for End User Computing Devices, Installation of patches (including OS, software and security) etc.Engage stakeholders professionally and in a timely manner

This role is for all Singaporeans or PRs, who graduated from ITE, Polytechnics, Universities and other private institutions in 2019/2020. Those who completed National Service in 2019/2020 are also welcomed to apply!

Click here to apply directly to this traineeship on mycareersfuture.sg
Disclaimer: Employee Referral Programme does not apply for this traineeship program.

Let’s shape a better world through technology. Join us to lead the change.
Note to Recruitment Agencies
In sourcing for candidates for particular roles, the Singtel Group works only with a panel of selected recruitment agencies expressly engaged under written agreements. Even then, these agencies are only activated from time to time for specific recruitment exercises for particular roles under instructions expressly issued by a member of the Singtel Talent Acquisition team.
Except under such circumstances, no agency shall source or attempt to source any candidates for the Singtel Group. The Singtel Group will not pay nor be obliged or liable to pay any recruitment fees of any kind whatsoever to any agency where candidate CVs are submitted to the Singtel Group by such agency on an unsolicited or speculative basis.
The Singtel Group reserves all rights to directly contact any candidate to which such CVs relate without any obligation or liability whatsoever to the agency concerned (including without limitation any obligation or liability to pay any recruitment fees of any kind)."
"Engineer, TV Engineering & Ops",Singtel,Singapore,"At Singtel, we believe in the strength of a vibrant, diverse and inclusive workforce where backgrounds, perspectives and life experiences of our people help us innovate and create strong connections with our customers. We strive to ensure all our people practices are non-discriminatory and provide a fair, performance-based work culture that is diverse, inclusive and collaborative.
Join us and experience what it’s like to be with an Employer of Choice*. Together, let’s create a brighter digital future for all. *Awarded at the HR Fest Awards 2020.


Singtel Networks, the most established telecommunications infrastructure provider in Singapore is transforming to enable the digital generation of tomorrow. We are introducing new capabilities in 5G, Cloud, Analytics, Digital Commerce, Software Engineering, Cyber Security to enhance our core competencies and deliver innovative and differentiated Mobile and Fixed services (Broadband, TV and Telephony) for our customers. We are committed to celebrating inclusion and diversity and is a strong believer to upskill and nurture all individuals. Come join us today as we build Singtel’s Networks of tomorrow, and Empower Every Generation to live, work and play in new ways!

Key Responsibilities include:
Perform the role of a Support Engineer for the Singtel TV broadcast systems – support three data centres onsite or remotely
Collaborate closely with the broadcast support and operations teams, as well as external stakeholders for troubleshooting and resolution
Conduct daily system monitoring and maintenance
Perform system administration tasks such as system hardening, patch installation and inventory
Maintain and update various technical documentation and engineering logs pertaining to broadcast equipment performance

We are committed to a safe and healthy environment for our employees & customers and will require all prospective employees to be fully vaccinated.

Softskills / Personal attributes:
Possess growth mindset, willing to take ownership.
Hands-on with ability to multi-task in a fast moving and rapidly changing environment.
Able to collaborate in a team to maximise teamwork and be empowered to work independently.
Willing to take ownership of assigned responsibilities and tasks.
Possess growth mindset and take initiatives to learn and grow."
Sales Operations Executive,Singtel,Singapore,"Designation : Sales Operations Officer, Asia
 Global Cyber Security
Salary : $2,000 to $2,500
Hire Type : 6 months contracts under recruitment agency payroll
Reporting Officer: Sales Operations Director, Asia

Description of Role:
The primary purpose of the position is to support the Sales Operations Department. This include but are not limited to order raising, billing and payment escalations.

Typical duties include:
Ensure timely and accurate day to day order rising, order closing and billings across various entities that Cyber is supporting.
Work closely with Sales Specialists and Account Management team for order raising, and order closing related matters.
Work closely with Product on customized orders processing and providing recommendations where available.
Support order provisioning for SME orders.
Support the team in terms of escalations investigations, coordinate with internal stakeholders to expedite order processing, delivery, order closure and billing.

Requirements:
Fresh A levels or 1-2 years working experience
Must have eye for details and ability to multitask
Independent, good time management and sensitive to numbers
Excellent interpersonal and communication skills with ability to work with all levels"
Project and Support Executive,Singtel,Singapore,"At Singtel, we believe in the strength of a vibrant, diverse and inclusive workforce where backgrounds, perspectives and life experiences of our people help us innovate and create strong connections with our customers. We strive to ensure all our people practices are non-discriminatory and provide a fair, performance-based work culture that is diverse, inclusive and collaborative.
Join us and experience what it’s like to be with an Employer of Choice*. Together, let’s create a brighter digital future for all. *Awarded at the HR Fest Awards 2020.


As an agile Business Analyst, defines improvements to business processes, gathers information to make decisions in designing customer journey, as well as perform quality assurance tests on solutions and products.
Extraordinary project management skills while independently overseeing the conceptualisation, planning, implementation, testing and launching of assigned projects relating to various digital platforms.
Ensures that deliverables to meet business and customer objectives are achieved.
Tracks, analyses and reports on all site metrics to evaluate on post-launch performance.
Supports incidents reported and drive resolution with IT and vendor.
Supports BAU improvement requests to ensure the successful rollout and positive CE and ROI.
Work collaboratively with other team members and various stakeholders to ensure smooth deliveries.
Supports other duties as assigned.

Requirements
Diploma, Business IT/Business Computing/Business Analyst
Experience with either 1 of the following: Agile/Scrum Experience, Digital Savviness or Project Management
Presentation
Managing stakeholders"
"Engineer, IP & Broadband Engring & Ops",Singtel,Singapore,"At Singtel, we believe in the strength of a vibrant, diverse and inclusive workforce where backgrounds, perspectives and life experiences of our people help us innovate and create strong connections with our customers. We strive to ensure all our people practices are non-discriminatory and provide a fair, performance-based work culture that is diverse, inclusive and collaborative.
Join us and experience what it’s like to be with an Employer of Choice*. Together, let’s create a brighter digital future for all. *Awarded at the HR Fest Awards 2020.


Singtel Networks, the most established telecommunications infrastructure provider in Singapore is transforming to enable the digital generation of tomorrow. We are introducing new capabilities in 5G, Cloud, Analytics, Digital Commerce, Software Engineering, Cyber Security to enhance our core competencies and deliver innovative and differentiated Mobile and Fixed services (Broadband, TV and Telephony) for our customers. We are committed to celebrating inclusion and diversity and is a strong believer to upskill and nurture all individuals. Come join us today as we build Singtel’s Networks of tomorrow, and Empower Every Generation to live, work and play in new ways!

Key Responsibilities include:
Driving and planning the development of the IP Core Network.
Manage projects from both business and operational perspectives, including expanding IP Network capabilities and new initiatives to bring fresh and strong business and operational excellence to the team.
Collaborate closely with both internal and external stakeholders.
Gathers and evaluates the requirements from the various functional entities and formulates the technical specifications and solution.
Performs technical and financial feasibility study on new emerging technologies or potential new services.

Softskills / Personal attributes:
Possess growth mindset, willing to take ownership.
Hands-on with ability to multi-task in a fast moving and rapidly changing environment.
Able to collaborate in a team to maximise teamwork and be empowered to work independently.
Willing to take ownership of assigned responsibilities and tasks.
Possess growth mindset and take initiatives to learn and grow.

We are committed to a safe and healthy environment for our employees & customers and will require all prospective employees to be fully vaccinated."
