Job Title,Company,Location,Job Description
"Engineer, Security",Singtel,Singapore,"At Singtel, we believe in the strength of a vibrant, diverse and inclusive workforce where backgrounds, perspectives and life experiences of our people help us innovate and create strong connections with our customers. We strive to ensure all our people practices are non-discriminatory and provide a fair, performance-based work culture that is diverse, inclusive and collaborative.
Join us and experience what it’s like to be with an Employer of Choice*. Together, let’s create a brighter digital future for all. *Awarded at the HR Fest Awards 2020.


Singtel Networks, the most established telecommunications infrastructure provider in Singapore is transforming to enable the digital generation of tomorrow. We are introducing new capabilities in 5G, Cloud, Analytics, Digital Commerce, Software Engineering, Cyber Security to enhance our core competencies and deliver innovative and differentiated Mobile and Fixed services (Broadband, TV and Telephony) for our customers. We are committed to celebrating inclusion and diversity and is a strong believer to upskill and nurture all individuals. Come join us today as we build Singtel’s Networks of tomorrow, and Empower Every Generation to live, work and play in new ways!

Key Responsibilities:
Supervise and oversee the Term Contractors in the provision of security services to 20+ SingTel premises.
Escalate any incidents threaten normal operations such as fire, security breaches, etc. and ensure that vendors attend to the breakdown / crisis promptly and accordingly.

Security Operations
Oversee management and operation of security, including access management, enforcement of security measures and procedures, investigation of security breaches etc.
Coordinate with external agencies, including regulatory and government agencies on matters concerning protection of critical infrastructures.
Prepare for security audits and related activities.
Manage day-to-day operations of Security Operations Centre

Project Management
Coordinate and monitor work progress at sites, including periodical site inspections and attending meetings, during the course of construction of projects.
Review the project specification prepared by contractors to ensure that it is in accordance to project specification.
Coordinate and monitor work progress at sites, including periodical site inspections and attending meetings, during the course of construction of projects.
Vet all tender and contract documents and technical specifications prepared by tenderers to ensure that operational and contractual requirements are met and that financial guidelines are complied with.
Source and recommend latest security technology from the market.
Manage security-by-design projects.

Others
Manage running of day to day operation at SOC.
Work with HR and IT department on new hiring physical access and enrollment issues.
Other duties as assigned.

Requirements:
Diploma or Degree from a recognized university, with min. 5 – 8 years of experience in Security Planning or SBD.
High integrity and a team player.
Ability to work independently and possess strong communication skills.
Effective written communication and report writing skills.
Professional qualifications in security and project management would be advantageous.
Experienced in security consulting and project management.
Ability to remain positively motivated at times of significant pressure, including assisting stakeholders to meet deadlines.

We are committed to a safe and healthy environment for our employees & customers and will require all prospective employees to be fully vaccinated.

We believe in the strength of a vibrant, diverse and inclusive workforce where backgrounds, perspectives and life experiences of our people help us innovate and create strong connections with our customers. We strive to ensure all our people practices are non-discriminatory and provide a fair, performance-based work culture that is diverse, inclusive and collaborative."
Customer Service Executive,Singtel,Singapore,"At Singtel, we believe in the strength of a vibrant, diverse and inclusive workforce where backgrounds, perspectives and life experiences of our people help us innovate and create strong connections with our customers. We strive to ensure all our people practices are non-discriminatory and provide a fair, performance-based work culture that is diverse, inclusive and collaborative.
Join us and experience what it’s like to be with an Employer of Choice*. Together, let’s create a brighter digital future for all. *Awarded at the HR Fest Awards 2020.


What will your typical day look like?
Coordinate and process New Mobile Applications, SIM Activation, Line Transfer, Activation of Value-Added Services (VASes), Re-contracting, etc.
Assist to billing query, resolve billing issues and perform billing adjustments if required.
Answer general customer service questions from Single Point of Contact (SPOC)/subscribers, explain multiple mobile product features, and where appropriate, transfer customer’s request to other department to obtain specific information if required.
Document all actions provided to order taker via internal system.
Ensure Standard Operating Procedure (SOP) and Work Instruction (WI) are properly carried out, and proper training provided to all staff and maintain constant update to these SOP if required.
Meet Customer Experience (CE) target set by management.
Perform duties as and when assigned by the Superior.
Monitor and ensure daily Service Level Agreement (SLA) for ticket resolution within 4-hour/7-hour/9-hour is met.
Abide to Singtel Health, Safety & Environmental policies and Quality & Security standards are executed and maintained at all times at the workplace.
Adhere to established CMO procedures and guidelines while providing quality customer service in order to meet and exceed department standards.

Is this you?
Diploma in any discipline
Minimum of 1 year of experience in a customer service environment
Able to speak and write fluent English
Good customer service and effective communication skills
Ability to handle difficult calls and emails in a professional manner
Display initiative and willingness to learn
Able to manage multiple service requests with strict time limits on an ongoing basis
Familiar with MS Office

We are committed to a safe and healthy environment for our employees & customers and will require all prospective employees to be fully vaccinated."
Sales Operations Assistant,Singtel,Singapore,"Designation: Sales Operations Assistant
Hire Type: Temp (1 month with option to extend to another month) - Under Recruitment Agency Payroll
Reporting Officer: Sales Operations Manger
Work Location: Level 26 Comcentre
Dept: Business and Sales Operations

Job Scope:
Data extraction, consolidation, mapping and clean up across multiple sources
Investigation and coordination on payment status
Review, tabulate and update changes on Orders
Prepare and submit order amendment documents
Track revise orders status and close orders
Raise Good Receipts for payment

Requirements:
Fresh A levels or 1-2 years working experience
Must have eye for details and ability to multitask
Independent, good time management and sensitive to numbers
Good in Excel"
Customer Care Officer (SME Business Hotline),Singtel,Singapore,"Singtel, Asia’s leading communications technology group, provides an extensive range of telecommunications and digital services to millions of consumers and businesses across Asia, Australia, Africa and the USA. With over 140 years of innovation behind us, we continue to push boundaries in our networks and services, to enrich lives and transform businesses.

Our core values – Customer Focus, Challenger Spirit, Teamwork, Integrity, and Personal Excellence – shape the way we work. We are passionate about making a difference and have an open and inclusive culture where everyone is empowered to do their best. Our diverse business means you will enjoy unique opportunities and rewarding experiences to learn and grow your career in a dynamic industry.

Join us and experience what it’s like to be with an Employer of Choice*. Together, let’s create a brighter digital future for all. *Awarded at the HR Fest Awards 2020


We are searching for passionate team players to join us as a Contact Centre Business SME Rep who can help to deliver an amazing and delightful customer experience for our business customers.
Our representatives reach out to our customers through calls, chats or emails on their queries /feedback and walk them through basic troubleshooting.

Responsibilities
Manage inbound calls, concurrent chats enquiries or business emails in a timely manner.
Provide extensive knowledge about specific products and services to resolve customer issues
Maintain records of all conversation interactions for accurate case history
Meet personal/team qualitative and quantitative targets
Navigate multiple technology applications
Maintain a positive and helpful approach in interactions with all customers
Requirements
Previous experience in a customer support role is a plus
Strong written and verbal communication skills along with active listening
Ability to work in a fast-paced environment
At least 5 GCE ‘O’ level credits (including English) or SPM P3 and above (including English)

We believe in the strength of a vibrant, diverse and inclusive workforce where backgrounds, perspectives and life experiences of our people help us innovate and create strong connections with our customers. We strive to ensure all our people practices are non-discriminatory and provide a fair, performance-based work culture that is diverse, inclusive and collaborative."
Senior Customer Care Officer,Singtel,Singapore,"At Singtel, we believe in the strength of a vibrant, diverse and inclusive workforce where backgrounds, perspectives and life experiences of our people help us innovate and create strong connections with our customers. We strive to ensure all our people practices are non-discriminatory and provide a fair, performance-based work culture that is diverse, inclusive and collaborative.
Join us and experience what it’s like to be with an Employer of Choice*. Together, let’s create a brighter digital future for all. *Awarded at the HR Fest Awards 2020.


Why Join Us?
You’ll love this role if you get your kicks by helping others. We’re looking a Singtel Care Advisor who loves solving problems and creating long term customer relationships. This is a great opportunity if you care deeply, genuinely and passionately about customer support and about the role it plays in making a customer-centric team successful.

What will your typical day look like?
Resolve enquiries and complaints made by SingTel customers through telephone or webchat
Process orders, forms, applications and requests
Record details of enquiries and customer interactions including actions taken
Communicate and coordinate with internal departments at all levels
Acquire multiple product knowledge to enhance ability to understand customer needs across different SingTel products.
Identify processes, procedures and workflow improvements and assist in the implementation
Meet and/or exceed all individual and team Key Performance Indicators (KPI) set by the management

Is this you?
Experienced in customer service or call centre environment
Familiar with MS and IT applications
Strong team player and self-driven individual
Customer-oriented with good interpersonal and communication skills
Highly adaptable to a fast-paced and dynamic environment
Possess critical thinking and problem-solving skills
Willing to work rotating shifts

Join us and experience what it’s like to be with an Employer of Choice*. Together, let’s create a brighter digital future for all. *Awarded at the HR Fest Awards 2020
Singtel, Asia’s leading communications technology group, provides an extensive range of telecommunications and digital services to millions of consumers and businesses across Asia, Australia, Africa and the USA. With over 140 years of innovation behind us, we continue to push boundaries in our networks and services, to enrich lives and transform businesses.
Kindly note that you may be required to work/standby on weekends and/or public holidays for this role.

We are committed to a safe and healthy environment for our employees & customers and will require all prospective employees to be fully vaccinated."
Accounts Payable Executive,Singtel,Singapore,"At Singtel, we believe in the strength of a vibrant, diverse and inclusive workforce where backgrounds, perspectives and life experiences of our people help us innovate and create strong connections with our customers. We strive to ensure all our people practices are non-discriminatory and provide a fair, performance-based work culture that is diverse, inclusive and collaborative.
Join us and experience what it’s like to be with an Employer of Choice*. Together, let’s create a brighter digital future for all. *Awarded at the HR Fest Awards 2020.


Responsibilities:
Support payment & analysis requirements for cashflow management.
Work together with onshore & offshore teams, liaise with Treasury & Authorisers to effect payment by value date.
Work with reporting, onshore & offshore teams on payment transactions & reconciliations and handle investigation on exceptions.
Liaise with banks & IT on payment issues.
Work with IT & banks on payment related enhancements & UAT.
Work with users and banks to process Banker's Guarantees for customers on time
Support business payment needs (e.g. new payment platform, new payment initiative etc)
Support reporting work and audit requirements
Ad-hoc assignments or rotation

Requirements:
Diploma in Accountancy
Minimum 3 years of working experience in Accounts Payable function
Basic knowledge in accounting
Proficiency with Microsoft Office
Verbal Communication skills, Interpersonal skills
Good time management and detail oriented
Experience in prioritizing tasks to meet deadlines
Meticulous and efficient to manage high volume of transactions
We are committed to a safe and healthy environment for our employees & customers and will require all prospective employees to be fully vaccinated."
Engineer - RNQ (Inbuilding Specialist Team),Singtel,Singapore,"Singtel Networks, the most established telecommunications infrastructure provider in Singapore is transforming to enable the digital generation of tomorrow. We are introducing new capabilities in 5G, Cloud, Analytics, Digital Commerce, Software Engineering, Cyber Security to enhance our core competencies and deliver innovative and differentiated Mobile and Fixed services (Broadband, TV and Telephony) for our customers. We are committed to celebrating inclusion and diversity and is a strong believer to upskill and nurture all individuals. Come join us today as we build Singtel’s Networks of tomorrow, and Empower Every Generation to live, work and play in new ways!


About this role:

In this role, you will be responsible for tunnel design strategy, RF requirement and technical solution evaluation to achieve cost effective tunnel coverage with good Quality of Service for SingTel Mobile’s 3G UMTS, 4G LTE and future wireless networks.
It will be essential for you to coordinate and maintain close inter-working relationships with external customers, suppliers as well as different departments in SingTel Mobile.

Key Responsibilities:
To perform tunnel design strategy and derive RF requirement for various tunnel projects.
To support Project Managers in technical RF scope of work and perform technical evaluation for new and existing tunnel projects.
To evaluate and review tunnel design proposal from vendor and conduct tender evaluation and clarification.
To plan for tunnel mobile coverage and capacity enhancement.
To support in vetting tender documents for RF-design and Acceptance criteria.
Any other duties assigned by the Supervisor.

The ideal candidate should possess/ be:
Degree in Electrical and Electronics or equivalent
Class 3 driving licence is compulsory.
Well verse in tunnel design and technical evaluation would be preferred.
Strong knowledge of the 3G UMTS and 4G LTE radio technology will be an added advantage.
Self-motivated, good communication, interpersonal and presentation skills.
Strong analytical skill and ability to conduct cost/benefit analysis.
Fresh graduates are welcome to apply.

We are committed to a safe and healthy environment for our employees & customers and will require all prospective employees to be fully vaccinated."
Retail Executive,Singtel,Singapore,"Singtel, Asia’s leading communications technology group, provides an extensive range of telecommunications and digital services to millions of consumers and businesses across Asia, Australia, Africa and the USA. With over 140 years of innovation behind us, we continue to push boundaries in our networks and services, to enrich lives and transform businesses.

Our core values – Customer Focus, Challenger Spirit, Teamwork, Integrity, and Personal Excellence – shape the way we work. We are passionate about making a difference and have an open and inclusive culture where everyone is empowered to do their best. Our diverse business means you will enjoy unique opportunities and rewarding experiences to learn and grow your career in a dynamic industry.

Join us and experience what it’s like to be with an Employer of Choice*. Together, let’s create a brighter digital future for all. *Awarded at the HR Fest Awards 2020


Drives sales through active engagement of customers, sharing product knowledge, explains and demonstrates the different functions and features of the products
Discover customers' needs and introduce different price plans and/or value-added services accordingly
Stay on top of the latest updates or developments on products, features or marketing/sales initiatives
Provide an excellent customer journey and experience for all customers
Requirements:
Minimum 'N' Level and above
Training will be provided and located in various part of Singapore
Sales experience will have added advantage
Willing to perform shift duties on weekends and public holidays
Attractive basic salary and Commission Package
We are committed to a safe and healthly environment for our employees & customers and will require all prospective employees to be fully vaccinated

We believe in the strength of a vibrant, diverse and inclusive workforce where backgrounds, perspectives and life experiences of our people help us innovate and create strong connections with our customers. We strive to ensure all our people practices are non-discriminatory and provide a fair, performance-based work culture that is diverse, inclusive and collaborative."
Associate Engineer,Singtel,Singapore,"At Singtel, we believe in the strength of a vibrant, diverse and inclusive workforce where backgrounds, perspectives and life experiences of our people help us innovate and create strong connections with our customers. We strive to ensure all our people practices are non-discriminatory and provide a fair, performance-based work culture that is diverse, inclusive and collaborative.
Join us and experience what it’s like to be with an Employer of Choice*. Together, let’s create a brighter digital future for all. *Awarded at the HR Fest Awards 2020.


Singtel Networks, the most established telecommunications infrastructure provider in Singapore is transforming to enable the digital generation of tomorrow. We are introducing new capabilities in 5G, Cloud, Analytics, Digital Commerce, Software Engineering, Cyber Security to enhance our core competencies and deliver innovative and differentiated Mobile and Fixed services (Broadband, TV and Telephony) for our customers. We are committed to celebrating inclusion and diversity and is a strong believer to upskill and nurture all individuals. Come join us today as we build Singtel’s Networks of tomorrow, and Empower Every Generation to live, work and play in new ways!

Responsibilities:
To ensure the contractors follow safety procedure in accordance to the work health and safety act (WHSA) and to use appropriate safety equipment so as to complete the assigned job efficiently and safely.
To compile and update contractor progress report for weekly diversion meeting.
Compile statistical reports on fiber network performance.
To issue fiber material vouchers to contractors.
To supervise technicians and contractors to execute all access fibre cable works in the area under his control in accordance with all established operation procedures and engineering instructions.
Responsible for all fibre cable diversion works including those in conjunction with road diversion and major government agencies.
Ensure that target handover dates for all fibre cable projects are met.
To use fiber equipment for fiber cable troubleshooting.

The Ideal candidate should possess:
Diploma in Electronics Enginieering or Information Technology.
Fresh Diploma Holders are welcome to apply.
Understand technical terms in Telco.
1 year of related working experience."
Customer Relationship Executive,Singtel,Singapore,"At Singtel, we believe in the strength of a vibrant, diverse and inclusive workforce where backgrounds, perspectives and life experiences of our people help us innovate and create strong connections with our customers. We strive to ensure all our people practices are non-discriminatory and provide a fair, performance-based work culture that is diverse, inclusive and collaborative.
Join us and experience what it’s like to be with an Employer of Choice*. Together, let’s create a brighter digital future for all. *Awarded at the HR Fest Awards 2020.


What will your typical day look like?
Communicate politely and timely with customers and stakeholders by SMS, email, letter, face to face, and telephone calls.
Investigate and solve customers’ long-standing or complex problems passed on by the authorities (CASE, MP, IDA, MDA) and stakeholders within the company.
Demonstrate awareness of the customers’ need by taking actions that are tailored to the customers’ needs and requirements.
Provide advice and assistance to customers that are using the products or services of the company.
Provide effective service recovery in addressing customer’s needs by ensuring compliance to service recovery procedures and minimizing costs through corrective actions
Co-ordinate with the relevant stakeholders to investigate and respond to customers in a timely manner.
Provide timely and accurate update of assigned cases to Management Team, respective authorities and stakeholders.
Identify and highlight issues that impact policies, processes and procedures for the necessary changes/improvements.
Work with stakeholders to investigate complaints and suggest improvements.
Be the voice of the customers. Suggest improvements and seek opportunities for innovation in customer service standards, policies and procedures for the company or department.
Keep abreast of developments and changes in products, services, policies and procedures by reading pertinent journals, attending briefing/meetings and courses.
Participate in a variety of special projects as requested, including explorations of system or process improvements and etc.
Is this you?
A Diploma in any discipline with credit in English
Minimum 2 years relevant working experience in a fast-paced environment and service industry
Good computer literacy with Microsoft Office applications
Possess strong customer service orientation
Possess strong command of written and spoken English
Demonstrate ability to interpret customer needs correctly
Possess politeness, confidence, tact, patience, politeness, and diplomacy while dealing with complex problems and irate customers
Possess a good work attitude and must be meticulous, organized, reliable and able to handle work pressure well
Independent and able to work under minimal supervision."
Supply Chain Executive,Singtel,Singapore,"At Singtel, we believe in the strength of a vibrant, diverse and inclusive workforce where backgrounds, perspectives and life experiences of our people help us innovate and create strong connections with our customers. We strive to ensure all our people practices are non-discriminatory and provide a fair, performance-based work culture that is diverse, inclusive and collaborative.
Join us and experience what it’s like to be with an Employer of Choice*. Together, let’s create a brighter digital future for all. *Awarded at the HR Fest Awards 2020.


What will your typical day look like?
Oversee and maintain the trade in handphones inventory and ensure stocks are accounted correctly at the various locations
Daily performance and monitoring of last mile delivery Vendors regarding collection and returns of trade in handphones.
Provide reports for business stakeholders on the trade in sales and margins
Calling of tenders on a regular basis.
Report on the SCM budget and Provide monthly reports on logistics expenses versus budget.
Arrange for payments on a regular basis.
Regularly visit warehouse and observe the processes and feedback on improvements.
Monitor all disposal requests for Singtel Assets as per company policy and arrange for clearance and calling of tenders if necessary.

Is this you?
Diploma preferably in Supply Chain or similar discipline
Warehousing and shipping, process improvement, transport management
Familiar with logistics processes.
Familiar with MS Excel and PowerPoint
Has knowledge of SAP system
Attention to details and accuracy
Affinity for numbers

We are committed to a safe and healthy environment for our employees & customers and will require all prospective employees to be fully vaccinated."
